{
  "accepted": true,
  "checks": [
    {"code": "IMPORTED_MESH_BLOCKMESH", "log": "log.blockMesh", "status": "passed"},
    {"code": "IMPORTED_MESH_SNAPPYHEXMESH_CHECK", "log": "log.snappyHexMesh-check", "status": "passed"},
    {"code": "IMPORTED_MESH_SNAPPYHEXMESH", "log": "log.snappyHexMesh", "status": "passed"},
    {"code": "IMPORTED_MESH_CHECKMESH", "log": "log.checkMesh", "status": "passed"},
    {"code": "IMPORTED_MESH_LIMIT_CELL_COUNT", "limit": 200000, "observed": 6400.0, "status": "passed"},
    {"code": "IMPORTED_MESH_LIMIT_MAXIMUM_NON_ORTHOGONALITY", "limit": 65.0, "observed": 15.74214263, "status": "passed"},
    {"code": "IMPORTED_MESH_LIMIT_MAXIMUM_SKEWNESS", "limit": 4.0, "observed": 0.1040891993, "status": "passed"},
    {"code": "IMPORTED_MESH_LIMIT_MAXIMUM_ASPECT_RATIO", "limit": 1000.0, "observed": 1.382976019, "status": "passed"}
  ],
  "directory": "examples/imported_duct_mesh/mesh-case",
  "durations_seconds": {
    "blockMesh": 0.3382562499609776,
    "checkMesh": 0.3572305419947952,
    "snappyHexMesh": 0.5942074169870466,
    "snappyHexMesh-check": 0.3627194580039941
  },
  "quantities": {
    "mesh.average_non_orthogonality": {"description": "", "kind": "quantity_of_interest", "name": "mesh.average_non_orthogonality", "shape": [], "unit": "deg", "value": 1.464064009},
    "mesh.cell_count": {"description": "", "kind": "quantity_of_interest", "name": "mesh.cell_count", "shape": [], "unit": "1", "value": 6400.0},
    "mesh.maximum_aspect_ratio": {"description": "", "kind": "quantity_of_interest", "name": "mesh.maximum_aspect_ratio", "shape": [], "unit": "1", "value": 1.382976019},
    "mesh.maximum_non_orthogonality": {"description": "", "kind": "quantity_of_interest", "name": "mesh.maximum_non_orthogonality", "shape": [], "unit": "deg", "value": 15.74214263},
    "mesh.maximum_skewness": {"description": "", "kind": "quantity_of_interest", "name": "mesh.maximum_skewness", "shape": [], "unit": "1", "value": 0.1040891993}
  },
  "return_codes": {
    "blockMesh": 0,
    "checkMesh": 0,
    "snappyHexMesh": 0,
    "snappyHexMesh-check": 0
  },
  "schema": "agentcfd.openfoam-imported-mesh-result/0.1"
}
